<?xml version="1.0"?>
<!DOCTYPE Report
[
<!ELEMENT Report (General ,(Doc|BPT)) >
<!ATTLIST Report ver CDATA #REQUIRED tmZone CDATA #REQUIRED>

<!ELEMENT General ( DocLocation ) >
<!ATTLIST General productName CDATA #REQUIRED productVer CDATA #REQUIRED os CDATA #REQUIRED host CDATA #REQUIRED>

<!ELEMENT BPT (DName,Res,DVer?,TSet?,TInst?,NodeArgs,AdditionalInfo*,Doc*) >
<!ATTLIST BPT rID ID #REQUIRED >

<!ELEMENT Doc (DName,Res,DVer?,TSet?,TInst?,RunType?,DT?,AdditionalInfo*,Step*,DIter*,Action*,Summary?,NodeArgs?) >
<!ATTLIST Doc rID ID #REQUIRED type (Test|BC) "Test" productName CDATA #REQUIRED BCIter CDATA #IMPLIED >

<!ELEMENT RunType ( #PCDATA )>
<!ATTLIST RunType fmStep (False|True) "False" batch (False|True) "False" upDesc (False|True) "False" upChk (False|True) "False" upAS (False|True) "False">

<!ELEMENT DName ( #PCDATA ) >

<!ELEMENT Res ( #PCDATA ) >

<!ELEMENT AdditionalInfo (AdditionalDataName,AdditionalDataValue ) >

<!ELEMENT AdditionalDataName ( #PCDATA ) >

<!ELEMENT AdditionalDataValue ( #PCDATA ) >

<!ELEMENT DVer ( #PCDATA ) >

<!ELEMENT TSet ( #PCDATA ) >

<!ELEMENT TInst ( #PCDATA ) >

<!ELEMENT DIter (Step?,Action+,Summary?,NodeArgs)>
<!ATTLIST DIter rID ID #REQUIRED iterID CDATA #REQUIRED>

<!ELEMENT DocLocation ( #PCDATA )>

<!ELEMENT Action (AName,AIter*,(Step|HtmlStep|Action)*,Summary,NodeArgs) >
<!ATTLIST Action rID ID #REQUIRED>

<!ELEMENT AIter ((Step|HtmlStep|Action)*,Summary?,NodeArgs) >
<!ATTLIST AIter rID ID #REQUIRED iterID CDATA #REQUIRED>

<!ELEMENT AName ( #PCDATA ) >

<!ELEMENT Step (Obj,Details,Time,(Step|HtmlStep|Doc)*,NodeArgs) >
<!ATTLIST Step rID ID #REQUIRED retval CDATA #IMPLIED>

<!ELEMENT HtmlStep (HTML,(Step|HtmlStep|Doc)*,NodeArgs) >
<!ATTLIST HtmlStep rID ID #REQUIRED >

<!ELEMENT Obj ( #PCDATA ) >
<!ATTLIST Obj plainTxt (False|True) "True">

<!ELEMENT Details ( #PCDATA ) >
<!ATTLIST Details plainTxt (False|True) "True">

<!ELEMENT Time ( #PCDATA ) >

<!ELEMENT HTML ( #PCDATA ) >

<!ELEMENT Disp ( #PCDATA ) >

<!ELEMENT NodeArgs (Disp,TopPane?,BtmPane?)>
<!ATTLIST NodeArgs eType CDATA #REQUIRED icon CDATA #REQUIRED nRep CDATA #REQUIRED filter (False|True) "True">
<!ATTLIST NodeArgs status (Passed|Failed|Done|Warning|Information) "Done">
<!ATTLIST NodeArgs iconSel CDATA #IMPLIED nType CDATA #IMPLIED MovieMarker CDATA "">

<!ELEMENT TopPane (Path)>

<!ELEMENT BtmPane ( (Path|WR)?,ASHilite?)>
<!ATTLIST BtmPane vType CDATA "HTML">

<!ELEMENT Path ( #PCDATA ) >

<!ELEMENT ASHilite ( #PCDATA ) >

<!ELEMENT WR ( #PCDATA ) >

<!ELEMENT DT (NodeArgs) >
<!ATTLIST DT rID ID #REQUIRED>

<!ELEMENT Summary (Param*)>
<!ATTLIST Summary sTime CDATA #IMPLIED eTime CDATA #IMPLIED passed CDATA #IMPLIED failed CDATA #IMPLIED warnings CDATA #IMPLIED retval CDATA #IMPLIED stopped (False|True) "False" >

<!ELEMENT Param (ParamName,ParamVal)+ >
<!ATTLIST Param paramInOut (In|Out) "In">

<!ELEMENT ParamName ( #PCDATA ) >

<!ELEMENT ParamVal ( #PCDATA ) >

]
>
<Report ver="2.0" tmZone="中国标准时间">
<General productName="QuickTest Professional" productVer="9.2" os="" host="CHT-DESKTOP"><DocLocation><![CDATA[C:\Users\cht\Program\Java\Test\test6\test]]></DocLocation></General>
<Doc rID="T1"   productName= "QuickTest Professional"  >
<DName><![CDATA[test]]></DName>
<Res><![CDATA[Res4]]></Res>
<DT rID="T2">
<NodeArgs eType="Table" icon="2" nRep="5" filter="False" >
<Disp><![CDATA[Run-Time Data Table]]></Disp>
<BtmPane vType="Table">
<Path><![CDATA[Default.xls]]></Path>
</BtmPane>
</NodeArgs>
</DT>
<DIter rID="T3" iterID="1" >
<Action rID="T4">
<AName><![CDATA[Action1]]></AName>
<Step rID="T5">
<Obj plainTxt="False" ><![CDATA[Login]]></Obj>
<Details plainTxt="False" ><![CDATA[Dialog]]></Details>
<Time><![CDATA[2021/4/23 - 21:59:58]]></Time>
<Step rID="T6">
<Obj plainTxt="False" ><![CDATA[Agent Name:.SetText]]></Obj>
<Details plainTxt="False" ><![CDATA["user1"]]></Details>
<Time><![CDATA[2021/4/23 - 21:59:58]]></Time>
<NodeArgs eType="Replay" icon="6" nRep="11" >
<Disp><![CDATA[Agent Name:.SetText]]></Disp>
</NodeArgs>
</Step>
<Step rID="T7">
<Obj plainTxt="False" ><![CDATA[Password:.SetText]]></Obj>
<Details plainTxt="False" ><![CDATA["MERCURY"]]></Details>
<Time><![CDATA[2021/4/23 - 21:59:58]]></Time>
<NodeArgs eType="Replay" icon="6" nRep="13" >
<Disp><![CDATA[Password:.SetText]]></Disp>
</NodeArgs>
</Step>
<Step rID="T8">
<Obj plainTxt="False" ><![CDATA[OK.Click]]></Obj>
<Details plainTxt="False" ><![CDATA[]]></Details>
<Time><![CDATA[2021/4/23 - 21:59:58]]></Time>
<NodeArgs eType="Replay" icon="7" nRep="15" >
<Disp><![CDATA[OK.Click]]></Disp>
</NodeArgs>
</Step>
<NodeArgs eType="Context" icon="5" nRep="10" >
<Disp><![CDATA[Login]]></Disp>
</NodeArgs>
</Step>
<Step rID="T9">
<Obj plainTxt="False" ><![CDATA[Flight Reservation]]></Obj>
<Details plainTxt="False" ><![CDATA[Window]]></Details>
<Time><![CDATA[2021/4/23 - 22:00:16]]></Time>
<Step rID="T10">
<Obj plainTxt="False" ><![CDATA[MaskEdBox.Type]]></Obj>
<Details plainTxt="False" ><![CDATA["123410"]]></Details>
<Time><![CDATA[2021/4/23 - 22:00:16]]></Time>
<NodeArgs eType="Replay" icon="9" nRep="18" status="Warning" >
<Disp><![CDATA[MaskEdBox.Type]]></Disp>
</NodeArgs>
</Step>
<Step rID="T11">
<Obj plainTxt="False" ><![CDATA[MaskEdBox]]></Obj>
<Details plainTxt="False" ><![CDATA[Object is disabled]]></Details>
<Time><![CDATA[2021/4/23 - 22:00:16]]></Time>
<Step rID="T12">
<Obj plainTxt="False" ><![CDATA[MaskEdBox]]></Obj>
<Details plainTxt="False" ><![CDATA[Object's physical description:<br>simclass = MSMask.MaskEdBox.1<br>ProgId = MSMask.MaskEdBox.1<br>]]></Details>
<Time><![CDATA[2021/4/23 - 22:00:16]]></Time>
<NodeArgs eType="Replay" icon="10" nRep="20" status="Warning" nType="Description" >
<Disp><![CDATA[MaskEdBox]]></Disp>
</NodeArgs>
</Step>
<NodeArgs eType="Replay" icon="9" nRep="19" status="Failed" nType="Run Error" >
<Disp><![CDATA[MaskEdBox]]></Disp>
</NodeArgs>
</Step>
<Step rID="T13">
<Obj plainTxt="False" ><![CDATA[Stop Run]]></Obj>
<Details plainTxt="False" ><![CDATA[Run stopped by user.]]></Details>
<Time><![CDATA[2021/4/23 - 22:00:16]]></Time>
<NodeArgs eType="General" icon="11" nRep="21" >
<Disp><![CDATA[Stop Run]]></Disp>
</NodeArgs>
</Step>
<NodeArgs eType="Context" icon="8" nRep="17" status="Failed" >
<Disp><![CDATA[Flight Reservation]]></Disp>
</NodeArgs>
</Step>
<Summary sTime="2021/4/23 - 21:59:58" eTime="2021/4/23 - 22:00:16" passed="0" failed="1" warnings="2" ></Summary>
<NodeArgs eType="StartAction" icon="4" nRep="8" status="Failed" >
<Disp><![CDATA[Action1 Summary]]></Disp>
</NodeArgs>
</Action>
<NodeArgs eType="StartIteration" icon="3" nRep="7" status="Failed" >
<Disp><![CDATA[test Iteration 1 (Row 1)]]></Disp>
</NodeArgs>
</DIter>
<Step rID="T14">
<Obj plainTxt="False" ><![CDATA[Stop Run]]></Obj>
<Details plainTxt="False" ><![CDATA[Run stopped by user.]]></Details>
<Time><![CDATA[2021/4/23 - 22:00:16]]></Time>
<NodeArgs eType="General" icon="12" nRep="24" >
<Disp><![CDATA[Stop Run]]></Disp>
</NodeArgs>
</Step>
<Summary sTime="2021/4/23 - 21:59:57" eTime="2021/4/23 - 22:00:16" passed="0" failed="1" warnings="2" stopped="True" ></Summary>
<NodeArgs eType="StartTest" icon="1" nRep="4" status="Failed" >
<Disp><![CDATA[Test test Summary]]></Disp>
</NodeArgs>
</Doc>
</Report>